name,description,rating,done,prep_time
Glace a la courgette,avec de la courgette et quand meme un peu de coco,4.2,true,
Glace a la biere,Avec bcp de biere,3,true,
Banana Pancakes,Crowd-pleasing banana pancakes made from scratch that are ready in minutes. A fun twist on ordinary pancakes.,4,true,
Banana Banana Bread,"This banana bread recipe creates the most delicious, moist loaf with loads of banana flavor. Why compromise the banana flavor? Friends and family love my recipe and say it's by far the best! It tastes wonderful toasted. Enjoy!",2.3,false,
Cookies,Chocolat,4.5,false,
Banana Banana Bread,"This banana bread recipe creates the most delicious, moist loaf with loads of banana flavor. Why compromise the banana flavor? Friends and family love my recipe and say it's by far the best! It tastes wonderful toasted. Enjoy!",4.6,false,
Supreme Strawberry Topping,"This homemade strawberry sauce is bursting with fresh strawberry flavor! Serve it cold as a dessert topping over cheesecake or ice cream. Or, warm it up and enjoy it for breakfast over pancakes or waffles. Store covered in the refrigerator.",4.8,false,10 mins
Chef John's Salmon Mango Bango,What's the best thing about being a chef? It's being able to name your dishes anything you want! The tropical tang of the fruit and the richness of the wild salmon work wonderfully together. The 'bango' comes from the spicy sweet pepper jam I use to bind the fresh mango relish.,4.8,true,10 mins
